{
  "schema": "ges.source-cache-manifest.v1",
  "source_id": "superpowers",
  "repo": "https://github.com/obra/superpowers.git",
  "commit": "b36e0829c6d0140e93cfef2ca599b1b07d4a7797",
  "selected_paths": [
    "skills/brainstorming/SKILL.md",
    "skills/brainstorming/scripts/frame-template.html",
    "skills/brainstorming/scripts/helper.js",
    "skills/brainstorming/scripts/server.cjs",
    "skills/brainstorming/scripts/start-server.sh",
    "skills/brainstorming/scripts/stop-server.sh",
    "skills/brainstorming/spec-document-reviewer-prompt.md",
    "skills/brainstorming/visual-companion.md",
    "skills/executing-plans/SKILL.md",
    "skills/finishing-a-development-branch/SKILL.md",
    "skills/receiving-code-review/SKILL.md",
    "skills/requesting-code-review/SKILL.md",
    "skills/requesting-code-review/code-reviewer.md",
    "skills/subagent-driven-development/SKILL.md",
    "skills/subagent-driven-development/implementer-prompt.md",
    "skills/subagent-driven-development/re-review-prompt.md",
    "skills/subagent-driven-development/scripts/review-package",
    "skills/subagent-driven-development/scripts/sdd-workspace",
    "skills/subagent-driven-development/scripts/task-brief",
    "skills/subagent-driven-development/task-reviewer-prompt.md",
    "skills/systematic-debugging/CREATION-LOG.md",
    "skills/systematic-debugging/SKILL.md",
    "skills/systematic-debugging/condition-based-waiting-example.ts",
    "skills/systematic-debugging/condition-based-waiting.md",
    "skills/systematic-debugging/defense-in-depth.md",
    "skills/systematic-debugging/find-polluter.sh",
    "skills/systematic-debugging/root-cause-tracing.md",
    "skills/systematic-debugging/test-academic.md",
    "skills/systematic-debugging/test-pressure-1.md",
    "skills/systematic-debugging/test-pressure-2.md",
    "skills/systematic-debugging/test-pressure-3.md",
    "skills/test-driven-development/SKILL.md",
    "skills/test-driven-development/writing-good-tests.md",
    "skills/using-git-worktrees/SKILL.md",
    "skills/using-superpowers/SKILL.md",
    "skills/using-superpowers/references/antigravity-tools.md",
    "skills/using-superpowers/references/codex-tools.md",
    "skills/using-superpowers/references/gemini-tools.md",
    "skills/using-superpowers/references/hermes-tools.md",
    "skills/using-superpowers/references/pi-tools.md",
    "skills/verification-before-completion/SKILL.md",
    "skills/writing-plans/SKILL.md",
    "skills/writing-plans/plan-document-reviewer-prompt.md"
  ],
  "content_digest": "sha256:762fbd815d062049339aef529d4f85f0116647006791ef1e2b922bc306057e31"
}
