{
  "schema": "ges.source-cache-manifest.v1",
  "source_id": "matt",
  "repo": "https://github.com/mattpocock/skills.git",
  "commit": "959a8e9f1edc3adbe2f7e3054bb6fbefa6696260",
  "selected_paths": [
    "skills/engineering/code-review/SKILL.md",
    "skills/engineering/code-review/agents/openai.yaml",
    "skills/engineering/codebase-design/DEEPENING.md",
    "skills/engineering/codebase-design/DESIGN-IT-TWICE.md",
    "skills/engineering/codebase-design/SKILL.md",
    "skills/engineering/codebase-design/agents/openai.yaml",
    "skills/engineering/diagnosing-bugs/SKILL.md",
    "skills/engineering/diagnosing-bugs/agents/openai.yaml",
    "skills/engineering/diagnosing-bugs/scripts/hitl-loop.template.sh",
    "skills/engineering/domain-modeling/ADR-FORMAT.md",
    "skills/engineering/domain-modeling/CONTEXT-FORMAT.md",
    "skills/engineering/domain-modeling/SKILL.md",
    "skills/engineering/domain-modeling/agents/openai.yaml",
    "skills/engineering/grill-with-docs/SKILL.md",
    "skills/engineering/grill-with-docs/agents/openai.yaml",
    "skills/engineering/implement/SKILL.md",
    "skills/engineering/implement/agents/openai.yaml",
    "skills/engineering/setup-matt-pocock-skills/SKILL.md",
    "skills/engineering/setup-matt-pocock-skills/agents/openai.yaml",
    "skills/engineering/setup-matt-pocock-skills/domain.md",
    "skills/engineering/setup-matt-pocock-skills/issue-tracker-github.md",
    "skills/engineering/setup-matt-pocock-skills/issue-tracker-gitlab.md",
    "skills/engineering/setup-matt-pocock-skills/issue-tracker-local.md",
    "skills/engineering/setup-matt-pocock-skills/triage-labels.md",
    "skills/engineering/tdd/SKILL.md",
    "skills/engineering/tdd/agents/openai.yaml",
    "skills/engineering/tdd/mocking.md",
    "skills/engineering/tdd/tests.md",
    "skills/engineering/to-spec/SKILL.md",
    "skills/engineering/to-spec/agents/openai.yaml",
    "skills/engineering/to-tickets/SKILL.md",
    "skills/engineering/to-tickets/agents/openai.yaml",
    "skills/productivity/grilling/SKILL.md",
    "skills/productivity/grilling/agents/openai.yaml"
  ],
  "content_digest": "sha256:e90383c8f145916927a426a0590cf1088fff79f4723d279ccfe54bfdb8c08cfc"
}
